"original_text","perturbed_text","original_score","perturbed_score","original_output","perturbed_output","ground_truth_output","num_queries","result_type"
"Seriously, I can't imagine how anyone could find a single flattering thing to say about this movie, much less find it in themselves to write the glowing compliments contained in this comment section. How many methamphetamines was Bogdonovitch on during the filming of this movie? Was he giving a bonus to the actor that spat his lines out with the most speed and least inflection or thought? The dialogue is bad, the plot atrocious, even for a ""screwball"" comedy, and claims that the movie is an homage to classic film comedy is about the most inane thing I've ever heard. The cinematography is below the quality and innovation of that exhibited by the worst made-for-TV movies, the acting is awful (although I get the feeling that the fault for that lies squarely in the lap of the director), and speaking of which, did I mention the direction is so haphazard and inscrutable that it defies the definition of the word? The whole thing is a terribly unfunny (even in the much-beleaguered world of so-bad-it's-funny clunkers), soul-sucking, waste of two hours of your life that you'll never get back. Be afraid, be very afraid...","Seriously, me can't behold how anyone could find a single flattering thing to say about this movie, much less find it in themselves to write the glowing compliments contained in this comment section. How many methamphetamines was Bogdonovitch on during the filming of this movie? Was he give a bonus to the actor that spat his lines out with the most speed and least inflection or thought? The dialogue is bad, the plot atrocious, even for a ""screwball"" kidding, and claims that the movie is an homage to classic film comedy is about the most inane thing I've ever hears. The cinematographer is below the qualifications and innovation of that proves by the worst made-for-TV movies, the acting is awful (although I get the feeling that the fault for that lies squarely in the lap of the director), and commenting of which, did me mention the guiding is so haphazard and inscrutable that it defies the definition of the word? The whole anything is a terrifically hilarious (even in the much-beleaguered worlds of so-bad-it's-funny clunkers), soul-sucking, loss of two hours of your life that you'll never achieve back. Constituted uneasy, is critically scary...",0.00017982721328735352,0.5306252837181091,0,1,0,659,"Successful"
"I'm the type of guy who loves hood movies from New Jack City to Baby Boy to Killa Season, from the b grade to the Hollywood. but this movie was something different. i am no hater and this movie was kinda enjoyable. but some bits were just weird. well the acting wasn't to good, compared to Silkk The Shockers performance in Hot Boyz (quite good) and Ice-T in new Jack and SVU (great). the scene where Corrupt (Ice-T) kills the wanna be Jamaican dude he says something and lights himself on fire burning both Ice-T and the other dude, this kills the Jamaican, however Ice-T is unharmed, very similar to Ice's other movie Urban Menace (which stars both of these actors) were Snoops character is supernatural, however after this there is nothing suggested that Corrupt is like a demon. When MJ (Silkk) gets stabbed at first he struggling but after that he fights normally and was stabbed in the thigh-WITH OUT BLOOD. and when MJ confesses killing a cop cos the cop was beating up his friend Benny was weird, Benny isn't introduced in this movie and the scene isn't in the film. it does hold weight to the fact why Corrupt wants to kill MJ but is still makes u scratch your head. wen Jody writes a letter to Miss Jones character explaining what happened to them afterwords doesn't mention what happen 2 other main characters MJ and Lisa. the film did show the horror and poverty of the ghetto-which plagues the lives of Latinos and Blacks word wide-was a good part of the film, even though the clip of the projects was re-used thousands of times. and the scene where Miles kills the Latino brother by crashing his bike at full speed (not wearing a helmet) and running into my Latino brothers car would of killed him. the movie was similar to the film Urban Menace and half the actors were in both of these movies as well as the production team. it was OK tho. but me being from poverty i love hood films, however if u don't love em like i do Don't WATCH IT. only thing saving me from walking out is it reminded me of the first movie i made which was made with 100 dollars, and my love of the genre.<br /><br />Nathaniel Purez","I'm the type of guy who loves hood movies from New Jack City to Baby Boy to Killa Season, from the b grade to the Hollywood. but this movie was something different. i am no hater and this movie was kinda enjoyable. but some bits were just weird. well the acting wasn't to good, compared to Silkk The Shockers performance in Hot Boyz (quite good) and Ice-T in new Jack and SVU (great). the scene where Corrupt (Ice-T) kills the wanna be Jamaican dude he says something and lights himself on fire burning both Ice-T and the other dude, this kills the Jamaican, however Ice-T is unharmed, very similar to Ice's other movie Urban Menace (which stars both of these actors) were Snoops character is supernatural, however after this there is nothing suggested that Corrupt is like a demon. When MJ (Silkk) gets stabbed at first he struggling but after that he fights normally and was stabbed in the thigh-WITH OUT BLOOD. and when MJ confesses killing a cop cos the cop was beating up his friend Benny was weird, Benny isn't introduced in this movie and the scene isn't in the film. it does hold weight to the fact why Corrupt wants to kill MJ but is still makes u scratch your head. wen Jody writes a letter to Miss Jones character explaining what happened to them afterwords doesn't mention what happen 2 other main characters MJ and Lisa. the film did show the horror and poverty of the ghetto-which plagues the lives of Latinos and Blacks word wide-was a good part of the film, even though the clip of the projects was re-used thousands of times. and the scene where Miles kills the Latino brother by crashing his bike at full speed (not wearing a helmet) and running into my Latino brothers car would of killed him. the movie was similar to the film Urban Menace and half the actors were in both of these movies as well as the production team. it was OK tho. but me being from poverty i love hood films, however if u don't love em like i do Don't WATCH IT. only thing saving me from walking out is it reminded me of the first movie i made which was made with 100 dollars, and my love of the genre.<br /><br />Nathaniel Purez",0.8834018707275391,0.8834018707275391,1,1,0,1,"Skipped"
"The most positive points in this film were the credits (text style) and some moments in Ice-T's acting. The story-line; two rival gangs having to fight it out, with the sub-plots of betrayal, power and change are well worn plots but in this case painful(very) to wade through. The decrepit scenery, which added slight believability in places, and questionable lighting, constantly distracted from any interest/identification with the characters (the shine off of the actress's forehead/nose was blinding, not to mention other scenes with the same problem.) Not even half way into the film I wanted to know more about how and why it came about as opposed to what was going on on screen. A disappointment if you have seen Ice-T in other roles. Kudos to other actors/actresses who seemed to get into their roles despite the weak direction; Corrupt's side kick and the other restaurant worker.","The most positive points in this film were the credits (text style) and some moments in Ice-T's acting. The story-line; two compete gangs having to combat it out, with the sub-plots of betrayal, abilities and change are well worn plots but in this case painful(very) to wade through. The antiquated landscapes, which added slight believability in places, and debatable reflector, constantly entertain from any interest/identification with the characters (the shine off of the actress's forehead/nose was blinding, not to mention other scenes with the same problem.) Not even half way into the film I wanted to know more about how and why it came about as opposed to what was going on on screen. A disappointment if you have seen Ice-T in other roles. Kudos to other actors/actresses who seemed to get into their roles despite the weak direction; Corrupt's side kick and the other restaurant worker.",0.0001919865608215332,0.5106008052825928,0,1,0,282,"Successful"
"I quite enjoyed The Wrecking Crew (1999), which was the last of the three films in this series (the first being Urban Menace (1999) which I've yet to see). I know it was baaaaad, but the three leads did a pretty decent job, all things considered.<br /><br />This, however, was truly atrocious. Ice-T was dreadful, and he's the producer! Can't say I've ever heard of Silkk The Shocker (who apparently never learnt how to spell), but his performance was one of the worst I've ever seen in a movie.<br /><br />Miss Jones did pretty well in her small role, though she later went on to make some atrocious, racist ""jokes"" on her radio show after the SE Asian tsunami (plus other occasions sadly). Way to go, girl...<br /><br />No-one else comes out with any credit. Strangely, TJ Storm and Ernie Hudson (who are both pretty bad here) are far better in The Wrecking Crew, which was made, along with Urban Menace, at the same time as Corrupt. How that works, I don't know.<br /><br />I'm going to try the Ice-T commentary now, to see whether he apologises for the film, or tries to make us think it's a great piece of film-making.","I quite enjoy The Wrecking Crew (1999), which was the last of the three films in this series (the first being Urban Menace (1999) which I've yet to see). I know it was baaaaad, but the three leads did a pretty worthwhile work, all things considered.<br /><br />This, however, was honest infamous. Ice-T was dreadful, and he's the grower! Can't say I've ever heard of Silkk The Shocker (who apparently never learnt how to spell), but his executes was one of the worst I've ever seen in a photographing.<br /><br />Miss Jones did pretty well in her small role, though she later went on to make some atrocious, racist ""jokes"" on her radio show after the SE Asian wave (plus other occasions sadly). Way to go, girl...<br /><br />No-one else comes out with any credit. Strangely, TJ Storm and Ernie Hudson (who are both pretty bad here) are far better in The Wrecking Crew, which was made, along with Urban Menace, at the same time as Corrupt. How that works, I don't know.<br /><br />I'm going to try the Ice-T commentary now, to see whether he apologises for the film, or tries to make us think it's a great piece of film-making.",0.00016689300537109375,0.52239590883255,0,1,0,388,"Successful"
"this film has no plot, no good acting, to be honest it has nothing, the same songs play over and over awful acting and if you can actually sit there and watch the whole thing and enjoy it there is something wrong with you. I wish i could give this 0 out of 10 but i cant so it has to be a 1 which is generous! ice-t isn't even a good rapper and even worse at acting, every bit of the film is rubbish, i got this film on DVD without knowing what it was for the price of £1.99 and thought that i had picked up a bargain, i then looked at the IMDb rating and didn't take it into consideration but after watching it found out that the DVD i had bought was a complete waste of time, money and electricity. if you have this film there are two things you can do sell it to someone who doesn't know about it or burn it!","this film has no chart, no exemplary acting, to be honest it has nothing, the same songs play over and over awful acting and if you can actually sit there and watched the whole thing and loves it there is something wrong with you. I wish i could give this 0 out of 10 but i cant so it has to be a 1 which is generous! ice-t isn't even a good rapper and even worse at behaved, any bit of the film is discard, i got this film on DVD without knowing what it was for the price of £1.99 and thought that i had picked up a mercado, i then looked at the IMDb rating and didn't take it into consideration but after view it proved out that the DVD i had bought was a complete scrap of moments, money and electrified. if you enjoys this film there are two things you can do sell it to someone who doesn't know about it or burn it!",0.00019317865371704102,0.779094398021698,0,1,0,395,"Successful"
"Beware, My Lovely (1952) Dir: Harry Horner <br /><br />Production: The Filmmakers/RKO Radio Pictures<br /><br />Credulity-straining thriller from the pioneering producer team of Collier Young and Ida Lupino, aka The Filmmakers (with Lupino pitching in with some uncredited direction). <br /><br />Robert Ryan is the 'peril' and Ida Lupino is the 'woman' in this entry in the 'woman in peril' style film. Ryan plays Howard Wilton, a tightly-wound psychotic handyman drifter (noooo, Ryan? I know, hard to believe). Lupino is the lonely war widow, Helen Gordon, who hires Howard to do some work around her house. Things go downhill from there as Howard makes Helen a prisoner in her own home. <br /><br />Howard has a nasty secret, not that he could reveal it. You see, consciousness is a real challenge for him. Maintaining it, that is. He has an unfortunate habit of coming to and finding his employers dead. This is part of the film's problem. The nature of Howard's psychosis is so extreme that it is nearly impossible to believe that he's been free to roam from town to town unobstructed, even in the year 1918 (when the film is set). He can't remember anything that happened ten minutes ago. His violent, threatening, anti-social tendencies are set off by the smallest and most common of things (a young girl flirting, inadequacies involving the war, due to his being rejected for service). I don't know how he even made it past the interview with Helen. There are other implausibilities. If you were locked in your house with a madman, but nonetheless left on your own for periods of time, couldn't you figure out a way to escape? <br /><br />Ryan, I think, is defeated by the material. It feels like he's overplaying his hand. His series of tics and spasms and the tightly coiled bursts of dementia all have a been-there, done-that robotic feel to them. At this point in his career he'd probably played this character, to some degree, ten times and it shows. We are encouraged to empathize with Howard (I didn't) through shown bits of humanity, like him being stopped in his tracks by a music box and his relating to a group of children who won't judge him. Lupino just has to act frazzled and in distress, which she is more than capable of and does. <br /><br />The picture had one thing going for it; what would be the eventual resolution of the conflict? So naturally there was a disappointing ending that was abrupt and ineffective. <br /><br />Of slight interest was a recurring motif where the camera would catch Howard's reflection (in mirrors, water, Christmas tree decorations). This indicated something going on, or about to go on, in his head. Horner (1953's Vicki), who made his reputation in production design, does a fine job of making the house feel like a prison. Credit too, the always reliable RKO art department for the work on the house. In the end, sub-standard work from the principals, who all have much better films to their credit. <br /><br />*½ out of 4","Beware, My Lovely (1952) Dir: Harry Horner <br /><br />Generated: The Writers/RKO Radio Pictures<br /><br />Credulity-straining suspenseful from the pioneering producer team of Collier Young and Ida Lupino, aka The Filmmakers (with Lupino pitching in with some uncredited direction). <br /><br />Robert Ryan is the 'peril' and Ida Lupino is the 'woman' in this entry in the 'woman in peril' style photos. Ryan dessert Howard Wilton, a tightly-wound crazy handyman drifter (noooo, Ryan? I know, hard to believe). Lupino is the lonely war widow, Helen Gordon, who hires Howard to do some work around her house. Things go progeny from there as Howard makes Helen a prisoner in her own home. <br /><br />Howard has a nasty secret, not that he could reveal it. You see, consciousness is a real challenge for him. Maintaining it, that is. He has an unfortunate habit of coming to and finding his employers dead. This is part of the film's problem. The nature of Howard's psychosis is so extreme that it is nearly impossible to believe that he's been free to roam from town to town unobstructed, even in the year 1918 (when the film is set). He can't remember anything that happened ten minutes ago. His violent, threatening, anti-social tendencies are set off by the smallest and most common of things (a young girl flirting, inadequacies involving the war, due to his being rejected for service). I don't know how he even made it past the interview with Helen. There are other implausibilities. If you were locked in your house with a madman, but nonetheless left on your own for periods of time, couldn't you figure out a way to escape? <br /><br />Ryan, I think, is conquered by the bodily. It feels like he's overplaying his hand. His series of tics and spasms and the tightly coiled bursts of dementia all have a been-there, done-that cranial sensation to them. At this point in his career he'd probably played this character, to some degree, tio times and it shows. We are encouraged to empathize with Howard (I didn't) through shown bits of humanity, like him being stopped in his tracks by a music box and his relating to a group of children who won't judge him. Lupino just has to act frazzled and in distress, which she is more than capable of and does. <br /><br />The picture had one thing going for it; what would be the eventual resolution of the conflict? So naturally there was a disappointing ending that was abrupt and ineffective. <br /><br />Of slight interest was a recurring motif where the camera would catch Howard's reflection (in mirrors, water, Christmas tree decorations). This indicated something going on, or about to go on, in his head. Horner (1953's Vicki), who made his reputation in production design, does a fine job of making the house feel like a prison. Credit too, the always reliable RKO art department for the work on the house. In the end, sub-standard work from the principals, who all have much better films to their credit. <br /><br />*½ out of 4",0.0005655884742736816,0.517099142074585,0,1,0,566,"Successful"
"The only reason this movie is not given a 1 (awful) vote is that the acting of both Ida Lupino and Robert Ryan is superb. Ida Lupino who is lovely, as usual, becomes increasingly distraught as she tries various means to rid herself of a madman. Robert Ryan is terrifying as the menacing stranger whose character, guided only by his disturbed mind, changes from one minute to the next. Seemingly simple and docile, suddenly he becomes clever and threatening. Ms. Lupino's character was in more danger from that house she lived in and her own stupidity than by anyone who came along. She could not manage to get out of her of her own house: windows didn't open, both front and back doors locked and unlocked from the inside with a key. You could not have designed a worse fire-trap if you tried. She did not take the precaution of having even one extra key. Nor could she figure out how to summon help from nearby neighbors or get out of her own basement while she was locked in and out of sight of her captor. I don't know what war her husband was killed in, but if it was World War II, the furnishings in her house, the styles of the clothes, especially the children and the telephone company repairman's car are clearly anachronistic. I recommend watching this movie just to see what oddities you can find.","The only reason this movie is not given a 1 (awful) vote is that the acting of both Ida Lupino and Robert Ryan is superb. Ida Lupino who is lovely, as usual, becomes increasingly distraught as she tries various means to rid herself of a madman. Robert Ryan is terrifying as the menacing stranger whose character, guided only by his disturbed mind, changes from one minute to the next. Seemingly simple and docile, suddenly he becomes clever and threatening. Ms. Lupino's character was in more danger from that house she lived in and her own stupidity than by anyone who came along. She could not manage to get out of her of her own house: windows didn't open, both front and back doors locked and unlocked from the inside with a key. You could not have designed a worse fire-trap if you tried. She did not take the precaution of having even one extra key. Nor could she figure out how to summon help from nearby neighbors or get out of her own basement while she was locked in and out of sight of her captor. I don't know what war her husband was killed in, but if it was World War II, the furnishings in her house, the styles of the clothes, especially the children and the telephone company repairman's car are clearly anachronistic. I recommend watching this movie just to see what oddities you can find.",0.9933896064758301,0.9933896064758301,1,1,0,1,"Skipped"
"Artificial melodrama with a screenplay adapted by Mel Dinelli from his play ""The Man"" concerns a boarding-house proprietress taking in a troubled handyman who may be homicidal. Despite solid work from Ida Lupino and Robert Ryan (both trying their best), this tedious yarn isn't very inventive within its one primary set (which quickly becomes visually dull) and underpopulated cast of characters (there is however a smart pooch who senses the worst!). Hokey and humorless, with a stilted direction from Harry Horner (perhaps Lupino should have directed?). Where's all the suspense promised by the ads? Dinelli also served as a co-producer. *1/2 from ****","Synthetic melodrama with a screenplay coping by Lunar Dinelli from his games ""The Man"" anxious a boarding-house proprietress taking in a troubled handyman who may get homicidal. Although solid collaborative from Ida Lupino and Robert Ryan (both trying their best), this tedious yarn isn't very inventive within its one essentials establishes (which readily become visually blunt) and underpopulated colada of habits (there is however a smart puppy who senses the worst!). Hokey and humorless, with a maudlin leadership from Harry Horner (perhaps Lupino should have directed?). Where's all the suspense promise by the ad? Dinelli also served as a co-producer. *1/2 from ****",0.00024622678756713867,0.5935115814208984,0,1,0,627,"Successful"
"Wow, what an overrated movie this turned out to be! It was supposed to be ""an extremely suspenseful tale of a crazed killer holding a woman hostage and in terror in her home."" Well, I doubt it terrorized audiences in the early '50s and I know it would put today's audiences asleep.<br /><br />""Sends shivers down the spine,"" proclaims the New York Times. No, the only shivers I get is that anyone is left on the planet who believes anything the N.Y. Times prints about anything.<br /><br />Well, it was about a deranged man who held a woman hostage for a short time in her house but the man. ""Howard Wilton"" (Robert Ryan) was actually harmless and friendly. In fact, this was one of the nicest roles Ryan ever played! Yes, ""Wilton"" was nuts but he never harmed the woman and only wanted a friend to trust.<br /><br />The film even turned boring after awhile with very little going on except a lot of yakking. <br /><br />Beware, my reader.....this sucks.","Wow, what an overrated movie this turned out to be! It was shouldered to be ""an extremely suspenseful tale of a crazed killer holding a woman hostage and in terror in her home."" Well, I doubt it terrorized audiences in the early '50s and I know it would put today's audiences asleep.<br /><br />""Sends shivers down the spine,"" proclaims the New York Times. No, the only shivers I get is that anyone is left on the planet who believes anything the N.Y. Times prints about anything.<br /><br />Well, it was about a hinky man who held a woman hostage for a short time in her house but the man. ""Howard Wilton"" (Robert Ryan) was actually unarmed and friendly. In fact, this was one of the nicest rolle Ryan ever played! Yes, ""Wilton"" was nuts but he never harmed the woman and only wanted a friend to trust.<br /><br />The film even turned uninspiring after awhile with very little going on except a shipments of gawking. <br /><br />Observant, my reader.....this disturbs.",0.0002434849739074707,0.960945725440979,0,1,0,309,"Successful"
