"original_text","perturbed_text","original_score","perturbed_score","original_output","perturbed_output","ground_truth_output","num_queries","result_type"
"Dr Stephens (Micheal Harvey) runs a mental asylum. He has a different approach to the insane. He conducts unorthodox methods of treatment. He treats everyone like family, there are no locks on the patients doors and he lets some of the inmates act out their twisted fantasies. He lets Sergeant Jaffee (Hugh Feagin) dress and act as a soldier and Harriet (Camilla Carr) be a mother to a doll, including letting her put it to bed in a cot. Dr. Stevens is outside letting Judge Oliver W. Cameron (Gene Ross) chop a log up with an axe, it turns out to be a bad move as once Dr. Stevens back is turned the Judge plants the axe in his shoulder. Soon after Nurse Charlotte Beale (Rosie Holotik) arrives at the Sanitarium having arranged an interview with Dr. Stevens about a possible job. She is met by the head Nurse, Geraldine Masters (Annabelle Weenick as Anne McAdams) and is offered a trail position. She gets to know and becomes well liked among the patients. However things eventually start to turn sour, the phone lines are cut, an old lady named Mrs. Callingham (Rhea MacAdams) has her tongue cut out and she starts to get a strange feeling that things just aren't right somehow. Then, one night all the Sanitariums dark secrets are violently revealed. Produced and directed by S.f. Brownrigg this film has a great central idea which builds into a cool twist ending, but ultimately is a bit of a chore to sit through because of it's low budget restrictions and a rather slow script by Tim Pope. There are just too many long boring stretches of dialogue by the inmates, not a lot really happens until the final twenty odd minutes. The film has no real visual quality as it's set entirely in the Sanitarium and it's grounds which is basically just a big bland house in the middle of nowhere. There's no graphic gore in it, a few splashes of blood here and there and thats yer lot. There's a bit of nudity, but like the gore not much. The acting is pretty strong, especially Holotik and Weenick. The photography is flat and unexciting and I can't even remember what the music was like. The twist ending is great, but it just takes far too long to get to it. A film that had a lot of potential that was probably held back by it's budget. OK I guess, but I think it would have worked a lot better if the story had been turned into a half an hour 'Tales form the Crypt' episode.","Dr Stephens (Micheal Harvey) runs a mental asylum. He has a different approach to the insane. He conducts unorthodox methods of treatment. He treats everyone like family, there are no locks on the patients doors and he lets some of the inmates act out their twisted fantasies. He lets Sergeant Jaffee (Hugh Feagin) dress and act as a soldier and Harriet (Camilla Carr) be a mother to a doll, including letting her put it to bed in a cot. Dr. Stevens is outside letting Judge Oliver W. Cameron (Gene Ross) chop a log up with an axe, it turns out to be a bad move as once Dr. Stevens back is turned the Judge plants the axe in his shoulder. Soon after Nurse Charlotte Beale (Rosie Holotik) arrives at the Sanitarium having arranged an interview with Dr. Stevens about a possible job. She is met by the head Nurse, Geraldine Masters (Annabelle Weenick as Anne McAdams) and is offered a trail position. She gets to know and becomes well liked among the patients. However things eventually start to turn sour, the phone lines are cut, an old lady named Mrs. Callingham (Rhea MacAdams) has her tongue cut out and she starts to get a strange feeling that things just aren't right somehow. Then, one night all the Sanitariums dark secrets are violently revealed. Produced and directed by S.f. Brownrigg this film is a great central contemplation which builds into a cool twist ending, but ultimately is a bit of a chore to sit through because of it's low budget restrictions and a rather slow script by Tim Pope. There are just too many long boring stretches of dialogue by the inmates, not a lot really happens until the final twenty odd minutes. The film has no real visual qualification as it's set entirely in the Sanitarium and it's grounds which is basically just a big bland house in the middle of nowhere. There's no graphic gore in it, a few splashes of blood here and there and thats yer lot. There's a bit of nudity, but like the gore not much. The acting is pretty strong, especially Holotik and Weenick. The photography is flat and unexciting and I can't even callbacks what the music was like. Both twist end is great, but it just takes far too long to get to it. A film that had a lot of potential that was probably held back by it's budget. OK I guess, but I think it would have worked a lot better if the story had been turned into a half an hour 'Tales form the Crypt' episode.",0.0002474188804626465,0.7171231508255005,0,1,0,411,"Successful"
"The Forgotten (AKA: Don't Look In The Basement) is a very cheaply made and very old looking horror movie.<br /><br />The story is very slow and never really reaches anything worth getting excited about.<br /><br />The patients at the asylum are embarrassingly funny especially Sam and the old woman who always quotes an old saying to everyone. (Look out for the bit when she gets close to the camera, tell me you can watch without laughing!).<br /><br />Now the gore is very poor looking, with the blood looking pink in many scenes so it doesn't really deserve its place on the video nasties list!.<br /><br />Overall if you aren't looking for a fantastic horror film and have some time to spare then it's worth a watch.","The Forgotten (AKA: Don't Look In The Basement) is a very cheaply given and very oldest exploring horror movie.<br /><br />The story is very lento and never really reaches anything chastisement getting excited about.<br /><br />The patients at the asylum are embarrassingly funny especially Sam and the old woman who always quotes an old saying to everyone. (Look out for the bit when she gets close to the camera, tell me you can watch without laughing!).<br /><br />Here the gore is very impoverished looking, with the blood looking pink in many scenes so it doesn't really justifies its place on the video nasties list!.<br /><br />Overall if you aren't looking for a fantastic horror film and have some time to spare then it's worth a watch.",0.00025588274002075195,0.5577621459960938,0,1,0,281,"Successful"
"This movie had a very unique effect on me: it stalled my realization that this movie REALLY sucks! It is disguised as a ""thinker's film"" in the likes of Memento and other jewels like that, but at the end, and even after a few minutes, you come to realize that this is nothing but utter pretentious cr4p. Probably written by some collage student with friends to compassionate to tell him that his writing sucks. The whole idea is  I don't even know if it tried to scratch on the supernatural, or they want us to believe that because someone fills your mind (a very weak one, btw) with stupid ""riddles"", the kind you learn on elementary school recess, you suddenly come to the ""one truth"" about everything, then you have to kill someone and confess. !!! What? How, what, why, WHY? Is just like saying that to make a cake, just throw a bunch of ingredients, and add water forgot about cooking it? I guess these guys forgot to, not explain, but present the mechanism of WHY was this happening? You have to do that when you present a story which normal, everyday acts (lie solving riddle rhymes) start to have an abnormal effect on people. Acting was horrible, with that girl always trying to look cute at the camera, and the guy from Highlanders, the series, acting up like the though heavy metal record store (yeah, they're all real though s-o-b's). The ""menacing"" atmosphere, with the ""oh-so-clever"" riddles (enter the 60's series of Batman and Robin, with guest appearance of The Riddle) and the crazies who claim to have ""the knowledge"" behind that smirk on their faces just horrible, HORRIBLE.<br /><br />I'm usually very partial about low budget movies, and tend to root for the underdog by giving them more praise than they may deserve, in lieu of their constrictions, you know, but this is just an ugly excuse for a movie that will keep you wanting to be good for an hour and a half, and at the end you will just lament that you fell for it.","This movie had a very unique effect on me: it stopped my enforcing that this movie REALLY sucks! He is disguised as a ""thinker's film"" in the likes of Memento and other jewels like that, but at the end, and even after a few minutes, you come to realize that this is nothing but utter snotty cr4p. Probably written by some collage student with boyfriend to compassionate to tell him that his writing sucks. The whole think is  me don't even realizing if it considered to scratch on the inexplicable, or they want us to contemplating that because everyone fills your mind (a very weak one, btw) with stupid ""riddles"", the kind you gets on elementary classroom recess, you brutally arriving to the ""one truth"" about everything, then you have to kill someone and confess. !!! What? How, what, why, WHY? Is just like explains that to make a cake, just throw a bunch of things, and add water forgot about cooking it? I thought these guys forgot to, not explain, but present the mechanism of WHY was this happening? You have to do that when you today a lore which normal, everyday acts (lie settlement riddle rhymes) start to have an abnormal consequences on people. Behaved was horrific, with that girl always trying to look cute at the camera, and the guy from Lancers, the serial, behaved up amateur the upon harsh steel records store (yeah, they're all true though s-o-b's). The ""perils"" atmosphere, with the ""oh-so-clever"" riddles (arrival the 60's series of Batman and Chacon, with asked attendance of The Riddle) and the dimwits who ask to received ""the lessons"" behind that laughs on their confronted just nasty, HORRIBLE.<br /><br />I'm primarily totally incomplete about less estimation scene, and proclivities to deepest for the underdog by giving them more greeting than they may deserve, in superseded of their constrictions, you see, but this is just an grisly excuse for a movie that determination garde you will to be super for an minute and a half, and at the end you go just wept that you crumbled for it.",0.00022023916244506836,0.5104374289512634,0,1,0,2059,"Successful"
"too bad this movie isn't. While ""Nemesis Game"" is mildly entertaining, I found it hard to suspend my disbelief the whole length of the movie, especially the situations that Sara was putting herself into. Are we supposed to believe that:<br /><br />1) this hot chick is going to go slumming unarmed around abandoned buildings and dark subway tunnels in the middle of the night just to solve some riddles?<br /><br />2) the protagonists are supposedly such experts that they play riddle games for fun, but don't put the whole ""I Never Sinned"" riddle together until the very end...and then...and then...get this...she has to do the whole mirror thing to finally put the pieces together?? I know it was the filmmaker's device to show the audience what was going on, but do they really think we're that stupid?<br /><br />3) when Vern and Sara go to the Chez M to question the blonde, there is not ONE topless chick in the whole building. Nada. C'mon. I know it's Canada, but I would expect more from a country that gave us Shannon Tweed.<br /><br />And anyone else notice that when Vern was surfing the Web and found that riddlezone site, that when he moused over the link the cursor stayed an arrow, and didn't turn into a little hand (LIKE ALL CURSORS DO WHEN YOU CLICK ON A HYPERLINK)?!? I mean, if you're gonna have the internet play such a prominent role in your movie, at least get the little things right. Geez.","too dirty this movie isn't. While ""Foe Game"" is briskly goofy, I found it hard to suspend my disbelief the whole length of the cinematographers, especially the situations that Sara was putting herself into. Are we supposed to believe that:<br /><br />1) this hot chick is going to go slumming unarmed around abandoned buildings and dark subway tunnels in the middle of the night just to solve some riddles?<br /><br />2) the protagonists are supposedly such experts that they play riddle games for lighthearted, but don't put the whole ""I Never Sinned"" riddle together until the very end...and then...and then...get this...she has to do the whole mirror thing to finally put the piece together?? me know it was the filmmaker's appliances to reflects the onlookers what was went on, but do they really think we're that nitwit?<br /><br />3) when Vern and Sara went to the Chez M to things the blonde, there is not ONE topless chick in the whole building. Nada. C'mon. I know it's Canada, but I would expect more from a country that gave us Shannon Plaid.<br /><br />And anyone else notice that when Vern was surfing the Networks and found that riddlezone site, that when he moused over the link the cursor stayed an arrow, and didn't revolving into a minor hand (LIKE ALL CURSORS DO WHEN YOU CLICK ON A HYPERLINK)?!? I mean, if you're gonna have the internet replay such a prominent role in your movie, at least get the little things properly. Frak.",0.0003349781036376953,0.5078642964363098,0,1,0,734,"Successful"
"I of course saw the previews for this at the beginning of some other Lion's Gate extravaganza, so of course it was only the best parts and therefore looked intriguing. And it is, to a point. A young college student (Sarah)is finding riddles all over the place and is becoming obsessed with answering them, and in doing so she's unwittingly becoming involved in some game. Now that's fairly intriguing right there but unfortunately it all gets rather muddled and becomes so complicated that the viewer (like myself) will most likely become frustrated. Characters appear with little introduction and you're not really sure who they are or why Sarah knows them or is hanging out with them. All of this has something to do with this woman who tried to drown a young boy years ago and her reason for that was that it's ""all part of the design"". In reality, it's all part of the ""very sketchy script"" and when the film is over you'll find yourself feeling that you've lost about an hour and a half of your life that you want back for more productive uses of your time, like cleaning the bathroom, for instance. 4 out of 10.","I of course saw the previews for this at the beginning of some other Lion's Gate extravaganza, so of course it was only the best parts and therefore looked intriguing. And it is, to a point. A young college student (Sarah)is finding riddles all over the place and is becoming obsessed with answering them, and in doing so she's unwittingly becoming involved in some game. Now that's fairly enigmatic right there but spectacularly it all gets rather muddled and becomes so complicated that the viewer (like myself) will most likely become frustrated. Characters appear with little introduction and you're not really sure who they are or why Sarah knows them or is hanging out with them. All of this has something to do with this woman who tried to drown a young boy years ago and her reason for that was that it's ""all part of the design"". In reality, it's all part of the ""very mysterious scripts"" and when the film is over you'll find yourself feeling that you've lost about an hour and a half of your life that you want back for more productive uses of your time, like cleaning the bathroom, for instance. 4 out of 10.",0.00017696619033813477,0.6290459036827087,0,1,0,181,"Successful"
"I gave this a 3 out of a possible 10 stars.<br /><br />Unless you like wasting your time watching an anorexic actress, in this film it's Carly Pope, behaving like a ditz, don't bother.<br /><br />Carly Pope plays Sara Novak, a young college student, who becomes intrigued with a game of riddles, that leads her down into subway tunnels underneath the city - a dangerous thing for even a well-armed man to go in alone.<br /><br />There are various intrigues in the film -- a weirdo classmate who is apparently stalking Sara, a cynical shopkeeper who runs some kind of offbeat hole-in-the-wall establishment that appears to be located in the back alley of a ghetto, a nerdish dim-wit that hangs around the cynic's shop, and a woman named Emily Gray, who is back in prison.<br /><br />Sara's father is a lawyer who is handling Emily Gray's case. <br /><br />A few years back, Emily Gray attempted to drown a 12 year old boy. Emily was put in a mental hospital for 5 years, and for some cockeyed reason they let her out again, even though it is obvious she is still dangerously deranged.<br /><br />The only explanation Emily has ever given for her crime is: I never sinned.<br /><br />It's all part of the design.<br /><br />Well, my friend, don't expect to ever get any better explanation than that, because you won't.","I gave this a 3 out of a possible 10 stars.<br /><br />Unless you like wasting your time watching an anorexic actress, in this film it's Carly Pope, behave like a ditz, don't bother.<br /><br />Carly Pope plays Sara Novak, a young college student, who becomes intrigued with a game of riddles, that leads her down into subway tunnels underneath the city - a dangerous thing for even a well-armed man to go in alone.<br /><br />There are various intrigues in the film -- a weirdo classmate who is apparently stalking Sara, a cynical shopkeeper who runs some kind of offbeat hole-in-the-wall establishment that appears to be located in the back alley of a ghetto, a nerdish dim-wit that hangs around the cynic's shop, and a woman named Emily Gray, who is back in prison.<br /><br />Sara's papa is a lawyer who is handling Emily Gray's case. <br /><br />A few years back, Emily Gray attempted to drown a 12 year old boy. Amelie was put in a mental hospital for 5 years, and for some cockeyed reason they let her out again, even though it is obvious she is still dangerously deranged.<br /><br />The only explanation Emilie has ever dispensed for her crime is: I never disobeyed.<br /><br />It's all part of the design.<br /><brit />Presentable, my friend, don't anticipated to ever ai any better explanation than that, because you won't.",0.0029748082160949707,0.5186823606491089,0,1,0,388,"Successful"
"I was looking forward to this movie. Trustworthy actors, interesting plot. Great atmosphere then ????? IF you are going to attempt something that is meant to encapsulate the meaning of life. First. Know it. OK I did not expect the directors or writers to actually know the meaning but I thought they may have offered crumbs to peck at and treats to add fuel to the fire-Which! they almost did. Things I didn't get. A woman wandering around in dark places and lonely car parks alone-oblivious to the consequences. Great riddles that fell by the wayside. The promise of the knowledge therein contained by the original so-called criminal. I had no problem with the budget and enjoyed the suspense. I understood and can wax lyrical about the fool and found Adrian Pauls role crucial and penetrating and then ????? Basically the story line and the script where good up to a point and that point was the last 10 minutes or so. What? Run out of ideas! Such a pity that this movie had to let us down so badly. It may not comprehend the meaning and I really did not expect the writers to understand it but I was hoping for an intellectual, if not spiritual ride and got a bump in the road","I was looking forward to this movie. Trustworthy artist, interesting plot. Great atmosphere then ????? IF you are going to attempt something that is meant to encapsulate the meaning of life. First. Know it. OK I did not expect the directors or writers to actually know the meaning but I thought they may have offered crumbs to peck at and treats to add fuel to the fire-Which! they almost did. Things I didn't get. A woman wandering around in dark places and lonely car parks alone-oblivious to the consequences. Great riddles that fell by the wayside. The promise of the knowledge therein contained by the original so-called criminal. I had no problem with the budget and enjoyed the suspense. I understood and can wax melancholic about the fool and found Adrian Pauls role crucial and penetrating and then ????? Basically the story line and the script where good up to a point and that point was the last 10 minutes or so. What? Run out of ideas! Such a pity that this movie had to let us down yet wrongly. It may not comprehend the meaning and I really did not expect the writers to understand it but I was hoping for an intellectual, if not spiritual ride and got a bump in the road",0.0018784403800964355,0.5745592713356018,0,1,0,233,"Successful"
"Four things intrigued me as to this film - firstly, it stars Carly Pope (of ""Popular"" fame), who is always a pleasure to watch. Secdonly, it features brilliant New Zealand actress Rena Owen. Thirdly, it is filmed in association with the New Zealand Film Commission. Fourthly, a friend recommended it to me. However, I was utterly disappointed. The whole storyline is absurd and complicated, with very little resolution. Pope's acting is fine, but Owen is unfortunately under-used. The other actors and actresses are all okay, but I am unfamiliar with them all. Aside from the nice riddles which are littered throughout the movie (and Pope and Owen), this film isn't very good. So the moral of the story is...don't watch it unless you really want to.","Four things intrigued me as to this film - especially, it stars Vanessa Pope (of ""Popular"" fame), who is always a pleasure to watch. Secdonly, it features brilliant New Zealand actress Rena Owen. Thirdly, it is filmed in association with the New Zealand Film Commission. Fourthly, a amie commend it to me. However, me was critically disappointed. The whole narrative is comical and challenge, with very kiddo solving. Pope's caretaker is fine, but Owen is sadly under-used. The other actors and players are all okay, but I am weird with them all. Additionally from the wondrous riddles which are littered throughout the movie (and Pope and Owen), this film isn't very good. So the moral of the story is...don't watch it unless you really want to.",0.00014913082122802734,0.5767819881439209,0,1,0,502,"Successful"
"<br /><br />Never ever take a film just for its good looking title.<br /><br />Although it all starts well, the film suffers the same imperfections you see in B-films. Its like at a certain moment the writer does not any more how to end the film, so he ends it in a way nobody suspects it thinking this way he is ingenious.<br /><br />A film to be listed on top of the garbage list.<br /><br />","<br /><br />Never ever take a film just for its good looking title.<br /><br />Although it all starts well, the film suffers the same imperfections you see in B-films. Its like at a certain moment the writer does not any more how to end the film, so he ends it in a way nobody suspects it mind this way he is ingenious.<br /><br />A film to be listed on top of the garbage list.<br /><br />",0.034126222133636475,0.9499581456184387,0,1,0,74,"Successful"
"Lowe returns to the nest after, yet another, failed relationship, to find he's been assigned to jury duty. It's in the plans to, somehow, get out of it, when he realizes the defendant is the girl he's had a serious crush on since the first grade.<br /><br />Through living in the past by telling other people about his feelings towards this girl (played by Camp), Lowe remembers those feelings and does everything in his power to clear Camp of attempted murder, while staying away from the real bad guys at the same time, and succeeding in creating a successful film at the same time.<br /><br />I've heard that St Augustine is the oldest city in the US, and I also know it has some ties to Ponce de Leon, so the backdrop is a good place to start. Unfortunately, it's the only thing good about this movie. The local police are inept, the judge is an idiot, and the defense counsel does everything in her power to make herself look like Joanie Cunningham! I don't know whether to blame the director for poor direction, or for just letting the cast put in such a hapless effort.<br /><br />In short, this movie was so boring, I could not even sleep through it! 1 out of 10 stars!","Lowe returns to the nest after, yet another, failed relationship, to find he's been assigned to jury duty. It's in the plans to, somehow, get out of it, when he realizes the defendant is the girl he's had a serious crush on since the first grade.<br /><br />Through living in the past by telling other people about his feelings towards this girl (played by Camp), Lowe remembers those feelings and does everything in his power to clear Camp of attempted murder, while staying away from the real bad guys at the same time, and succeeding in creating a successful film at the same time.<br /><br />I've heard that St Augustine is the oldest city in the US, and I also know it has some ties to Ponce de Leon, so the backdrop is a satisfying place to start. Spectacularly, it's the only thing good about this movie. The local police are inept, the judge is an idiot, and the defense counsel does everything in her power to make herself look like Joanie Cunningham! I don't acknowledging whether to adjudged the director for poor directives, or for just letting the cast put in such a sorrowful effort.<br /><br />For little, this film was once uninspiring, me could not even sor through it! 1 out of 10 fame!",0.0001805424690246582,0.7440273761749268,0,1,0,481,"Successful"
