"original_text","perturbed_text","original_score","perturbed_score","original_output","perturbed_output","ground_truth_output","num_queries","result_type"
"I love sci-fi and am willing to put up with a lot. Sci-fi movies/TV are usually underfunded, under-appreciated and misunderstood. I tried to like this, I really did, but it is to good TV sci-fi as Babylon 5 is to Star Trek (the original). Silly prosthetics, cheap cardboard sets, stilted dialogues, CG that doesn't match the background, and painfully one-dimensional characters cannot be overcome with a 'sci-fi' setting. (I'm sure there are those of you out there who think Babylon 5 is good sci-fi TV. It's not. It's clichéd and uninspiring.) While US viewers might like emotion and character development, sci-fi is a genre that does not take itself seriously (cf. Star Trek). It may treat important issues, yet not as a serious philosophy. It's really difficult to care about the characters here as they are not simply foolish, just missing a spark of life. Their actions and reactions are wooden and predictable, often painful to watch. The makers of Earth KNOW it's rubbish as they have to always say ""Gene Roddenberry's Earth..."" otherwise people would not continue watching. Roddenberry's ashes must be turning in their orbit as this dull, cheap, poorly edited (watching it without advert breaks really brings this home) trudging Trabant of a show lumbers into space. Spoiler. So, kill off a main character. And then bring him back as another actor. Jeeez! Dallas all over again.","me enjoyed sci-fi and am wish to rendered up with a number. Sci-fi teatro/TELEVISION are sometimes underfunded, under-appreciated and misunderstood. I strive to like this, I actually did, but it is to nice NUNEZ sci-fi as Babylon 5 is to Sung Hikes (the aboriginal). Grotesque surgeon, cheap cardboard stipulates, maudlin dialogues, FIM that doesn't coincidence the regard, and patiently one-dimensional characters cannot exists surpassed with a 'sci-fi' fixture. (I'm certainty there are those of you out there who knew Babylon 5 is appropriate sci-fi BROADCASTING. It's not. It's melodrama and distasteful.) During VS fans achievable amour feeling and properties changing, sci-fi is a sorting that es not having itself intently (fc. Star Trek). It may resolved imperative dots, yet not as a difficult philosophers. It's fully complex to loving about the character here as they are not simply foolish, just lost a ignited of resides. Their stepping and reply are wooden and anticipated, always poignant to watching. Both craftsman of Soils AWARE it's rubbish as they enjoy to always say ""Hereditary Roddenberry's Terre..."" otherwise resident would not lifelong notes. Roddenberry's ash must es turning in their orbiting as this dull, cheap, poorly editor (watching it without advert breaks really brings this home) trudging Trabant of a show lumbers into space. Spoiler. So, kill off a main character. And then bring him back as another actor. Jeeez! Dallas all over again.",0.0001729130744934082,0.5110101103782654,0,1,0,2258,"Successful"
"Worth the entertainment value of a rental, especially if you like action movies. This one features the usual car chases, fights with the great Van Damme kick style, shooting battles with the 40 shell load shotgun, and even terrorist style bombs. All of this is entertaining and competently handled but there is nothing that really blows you away if you've seen your share before.<br /><br />The plot is made interesting by the inclusion of a rabbit, which is clever but hardly profound. Many of the characters are heavily stereotyped -- the angry veterans, the terrified illegal aliens, the crooked cops, the indifferent feds, the bitchy tough lady station head, the crooked politician, the fat federale who looks like he was typecast as the Mexican in a Hollywood movie from the 1940s. All passably acted but again nothing special.<br /><br />I thought the main villains were pretty well done and fairly well acted. By the end of the movie you certainly knew who the good guys were and weren't. There was an emotional lift as the really bad ones got their just deserts. Very simplistic, but then you weren't expecting Hamlet, right? The only thing I found really annoying was the constant cuts to VDs daughter during the last fight scene.<br /><br />Not bad. Not good. Passable 4.","Worth the entertainment value of a rental, especially if you like action movies. This one features the usual car chases, fights with the great Van Damme kick style, shooting battles with the 40 shell load shotgun, and even terrorist style bombs. All of this is entertaining and competently handled but there is nothing that really blows you away if you've seen your share before.<br /><br />The plot is made interesting by the inclusion of a rabbit, which is clever but merely profound. Many of the characters are heavily stereotyped -- the angry veterans, the terrified illegal aliens, the crooked cops, the indifferent feds, the bitchy tough lady station head, the crooked politician, the fat federale who looks like he was typecast as the Mexican in a Hollywood movie from the 1940s. All passably acted but again nothing special.<br /><br />I thought the main villains were pretty well done and fairly well acted. By the end of the movie you certainly knew who the good guys were and weren't. There was an emotional lift as the really bad ones got their just deserts. Very simplistic, but then you weren't expecting Hamlet, right? The only thing I found really annoying was the constant cuts to VDs daughter during the last fight scene.<br /><br />Not bad. Either good. Passable 4.",0.0036646127700805664,0.5736563205718994,0,1,0,161,"Successful"
"its a totally average film with a few semi-alright action sequences that make the plot seem a little better and remind the viewer of the classic van dam films. parts of the plot don't make sense and seem to be added in to use up time. the end plot is that of a very basic type that doesn't leave the viewer guessing and any twists are obvious from the beginning. the end scene with the flask backs don't make sense as they are added in and seem to have little relevance to the history of van dam's character. not really worth watching again, bit disappointed in the end production, even though it is apparent it was shot on a low budget certain shots and sections in the film are of poor directed quality","its a totally average film with a few semi-alright action sequences that make the plot seem a little better and remind the viewer of the classic van dam films. parts of the plot don't make sense and seem to be added in to use up time. the end plot is that of a very basic type that doesn't leave the viewer guessing and any twists are obvious from the beginning. the end scene with the flask backs don't make sense as they are added in and seem to have little relevance to the history of van dam's character. not really pena watching again, bit disappointed in the end production, even though it is apparent it was shot on a low budget certain shots and sections in the film are of poor directed quality",0.0037667155265808105,0.5365328192710876,0,1,0,92,"Successful"
"STAR RATING: ***** Saturday Night **** Friday Night *** Friday Morning ** Sunday Night * Monday Morning <br /><br />Former New Orleans homicide cop Jack Robideaux (Jean Claude Van Damme) is re-assigned to Columbus, a small but violent town in Mexico to help the police there with their efforts to stop a major heroin smuggling operation into their town. The culprits turn out to be ex-military, lead by former commander Benjamin Meyers (Stephen Lord, otherwise known as Jase from East Enders) who is using a special method he learned in Afghanistan to fight off his opponents. But Jack has a more personal reason for taking him down, that draws the two men into an explosive final showdown where only one will walk away alive.<br /><br />After Until Death, Van Damme appeared to be on a high, showing he could make the best straight to video films in the action market. While that was a far more drama oriented film, with The Shepherd he has returned to the high-kicking, no brainer action that first made him famous and has sadly produced his worst film since Derailed. It's nowhere near as bad as that film, but what I said still stands.<br /><br />A dull, predictable film, with very little in the way of any exciting action. What little there is mainly consists of some limp fight scenes, trying to look cool and trendy with some cheap slo-mo/sped up effects added to them that sadly instead make them look more desperate. Being a Mexican set film, director Isaac Florentine has tried to give the film a Robert Rodriguez/Desperado sort of feel, but this only adds to the desperation.<br /><br />VD gives a particularly uninspired performance and given he's never been a Robert De Niro sort of actor, that can't be good. As the villain, Lord shouldn't expect to leave the beeb anytime soon. He gets little dialogue at the beginning as he struggles to muster an American accent but gets mysteriously better towards the end. All the supporting cast are equally bland, and do nothing to raise the films spirits at all.<br /><br />This is one shepherd that's strayed right from the flock. *","SING EVALUATIONS: ***** Saturday Night **** Friday Night *** Friday Morning ** Sunday Night * Monday Morning <br /><br />Former New Orleans homicide pops Jack Robideaux (Jean Claude Van Damme) is re-assigned to Columbus, a small but violent town in Mexico to help the detectives there with their efforts to stop a major heroin smuggling operation into their town. The culprits turn out to be ex-military, lead by former commander Benjamin Meyers (Stephen Lord, otherwise known as Jase from East Enders) who is using a special method he learned in Afghanistan to fight off his opponents. But Jack has a more personal raison for taking him down, that draws the two men into an explosive final showdown where only one will walk away alive.<br /><br />After Until Death, Van Damme talked to got on a high, showing he could makes the best straight to filmmaking films in the action market. While that was a far more drama oriented film, with The Shepherd he has returned to the high-kicking, no brainer operation that first made him famous and has sadly produced his worst film since Derailed. It's nowhere near as unfavorable as that film, but what I declare still stands.<br /><br />A dull, predictable film, with very little in the way of any exciting action. What little there is mainly pertains of some limp fight scenes, trying to look cool and trendy with some cheap slo-mo/sped up effects added to them that sadly instead make them look more desperate. Being a Mexican set film, direktor Isaac Florentine has tried to give the film a Robert Rodriguez/Desperado sort of feel, but this only adds to the desperation.<br /><br />NAR gives a particularly hokey accomplishment and given he's never been a Robert De Niro sort of actor, that can't be good. As the villain, Jeez shouldn't expectations to leave the beeb anytime soon. His gotten slight discussing at the beginnings as he struggles to muster an American accent but gets mysteriously better towards the concluded. All the supporting cast are equally hokey, and do nothing to raise the films spirits at all.<br /><br />This is one shepherd that's journeyed right from the flock. *",0.0001596212387084961,0.5043389797210693,0,1,0,1120,"Successful"
"First off let me say, If you haven't enjoyed a Van Damme movie since bloodsport, you probably will not like this movie. Most of these movies may not have the best plots or best actors but I enjoy these kinds of movies for what they are. This movie is much better than any of the movies the other action guys (Segal and Dolph) have thought about putting out the past few years. Van Damme is good in the movie, the movie is only worth watching to Van Damme fans. It is not as good as Wake of Death (which i highly recommend to anyone of likes Van Damme) or In hell but, in my opinion it's worth watching. It has the same type of feel to it as Nowhere to Run. Good fun stuff!","First off let me say, If you haven't enjoyed a Van Damme movie since bloodsport, you probably will not like this movie. Most of these movies may not have the best plots or best actors but I enjoy these kinds of movies for what they are. This movie is much better than any of the movies the other action guys (Segal and Dolph) have thought about putting out the past few years. Van Damme is good in the movie, the movie is only worth watching to Van Damme fans. It is not as good as Wake of Death (which i highly recommend to anyone of likes Van Damme) or In hell but, in my opinion it's worth watching. It has the same type of feel to it as Nowhere to Run. Good fun stuff!",0.9997177124023438,0.9997177124023438,1,1,0,1,"Skipped"
"I had high hopes for this one until they changed the name to 'The Shepherd : Border Patrol, the lamest movie name ever, what was wrong with just 'The Shepherd'. This is a by the numbers action flick that tips its hat at many classic Van Damme films. There is a nice bit of action in a bar which reminded me of hard target and universal soldier but directed with no intensity or flair which is a shame. There is one great line about 'being p*ss drunk and carrying a rabbit' and some OK action scenes let down by the cheapness of it all. A lot of the times the dialogue doesn't match the characters mouth and the stunt men fall down dead a split second before even being shot. The end fight is one of the better Van Damme fights except the Director tries to go a bit too John Woo and fails also introducing flashbacks which no one really cares about just gets in the way of the action which is the whole point of a van Damme film.<br /><br />Not good, not bad, just average generic action.","me had high expecting for this one until they changed the name to 'The Shepherd : Border Patrol, the lamest movie name ever, what was wrong with just 'The Shepherd'. This is a by the numbers action flick that tips its chapeau at many classic Van Damme films. There is a nice piece of action in a barre which reminded me of hard target and universal soldier but directed with no intensity or flair which is a shame. There is one great pursuant about 'being p*ss drunk and carrying a rabbit' and some OK action scenes licensed down by the cheapness of it all. A lot of the times the dialogue doesn't match the characters mouth and the stunt men fall down dead a split second before even being shot. Both end fight is one of the better Van Damme fights except the Director tries to go a bit too John Woo and fails also introducing reliving which no one really cares about just gets in the way of the action which is the whole point of a van Damme film.<br /><br />Not good, not bad, just average generic measure.",0.00020807981491088867,0.6656737327575684,0,1,0,287,"Successful"
"Isaac Florentine has made some of the best western Martial Arts action movies ever produced. In particular US Seals 2, Cold Harvest, Special Forces and Undisputed 2 are all action classics. You can tell Isaac has a real passion for the genre and his films are always eventful, creative and sharp affairs, with some of the best fight sequences an action fan could hope for. In particular he has found a muse with Scott Adkins, as talented an actor and action performer as you could hope for. This is borne out with Special Forces and Undisputed 2, but unfortunately The Shepherd just doesn't live up to their abilities.<br /><br />There is no doubt that JCVD looks better here fight-wise than he has done in years, especially in the fight he has (for pretty much no reason) in a prison cell, and in the final showdown with Scott, but look in his eyes. JCVD seems to be dead inside. There's nothing in his eyes at all. It's like he just doesn't care about anything throughout the whole film. And this is the leading man.<br /><br />There are other dodgy aspects to the film, script-wise and visually, but the main problem is that you are utterly unable to empathise with the hero of the film. A genuine shame as I know we all wanted this film to be as special as it genuinely could have been. There are some good bits, mostly the action scenes themselves. This film had a terrific director and action choreographer, and an awesome opponent for JCVD to face down. This could have been the one to bring the veteran action star back up to scratch in the balls-out action movie stakes.<br /><br />Sincerely a shame that this didn't happen.","Isaac Florentine has made some of the best western Martial Arts action movies ever produced. In particular US Seals 2, Cold Harvest, Special Forces and Undisputed 2 are all action classics. You can tell Isaac has a real passion for the genre and his films are always eventful, creative and sharp affairs, with some of the best fight sequences an action fan could hope for. In particular he has found a muse with Scott Adkins, as talented an actor and action performer as you could hope for. This is borne out with Special Forces and Undisputed 2, but unfortunately The Shepherd just doesn't resident up to their abilities.<br /><br />There is no doubt that JCVD looks better here fight-wise than he has done in years, especially in the fight he has (for pretty much no reason) in a prison cell, and in the final showdown with Scott, but look in his eyes. JCVD seems to be dead inside. There's nothing in his eyes at all. It's like he just doesn't zorg about anything throughout the whole film. And this is the culminate man.<br /><br />There are other sketchy respects to the film, script-wise and visually, but the main problem is that you are utterly unable to empathise with the hero of the film. A genuine shame as I know we all wanted this film to be as special as it genuinely could have been. There are some good bits, mostly the action scenes themselves. This film haya a terrific director and action choreographer, and an awesome opponent for JCVD to face down. This could have been the one to bring the veteran action star back up to scratch in the balls-out action movie stakes.<br /><br />Sincerely a shame that this didn't happen.",0.0006510615348815918,0.6663374304771423,0,1,0,307,"Successful"
"It actually pains me to say it, but this movie was horrible on every level. The blame does not lie entirely with Van Damme as you can see he tried his best, but let's face it, he's almost fifty, how much more can you ask of him? I find it so hard to believe that the same people who put together Undisputed 2; arguably the best (western) martial arts movie in years, created this. Everything from the plot, to the dialog, to the editing, to the overall acting was just horribly put together and in many cases outright boring and nonsensical. Scott Adkins who's fight scenes seemed more like a demo reel, was also terribly underused and not even the main villain which is such a shame because 1) He is more than capable of playing that role and 2) The actual main villain was not only not intimidating at all but also quite annoying. Again, not blaming Van Damme. I will always be a fan, but avoid this one.","It actually pains me to say it, but this movie was horrible on any echelon. The blame does not lie entirely with Van Damme as you can see he tried his best, but let's face it, he's almost fortieth, how much more can you ask of him? me find it so hard to believe that the same people who put together Undisputed 2; arguably the best (ouest) martial arts movie in seniors, constructing this. Everything from the plot, to the dialog, to the editing, to the ensemble acting was just terrifically bringing collectively and in various trial absolute blunt and wanton. Scott Mcgee who's fight scenes considered more analog a show reel, was also terribly underused and not even the central villain which is such a disgrace because 1) It is more than able of playing that roles and 2) The realistic critical villain was not only not threaten at all but also very frustrating. Till, not blaming Minibus Damme. me dedication always is a fans, but bypassing this one.",0.00018459558486938477,0.5314376354217529,0,1,0,929,"Successful"
"Technically I'am a Van Damme Fan, or I was. this movie is so bad that I hated myself for wasting those 90 minutes. Do not let the name Isaac Florentine (Undisputed II) fool you, I had big hopes for this one, depending on what I saw in (Undisputed II), man.. was I wrong ??! all action fans wanted a big comeback for the classic action hero, but i guess we wont be able to see that soon, as our hero keep coming with those (going -to-a-border - far-away-town-and -kill -the-bad-guys- than-comeback- home) movies I mean for God's sake, we are in 2008, and they insist on doing those disappointing movies on every level. Why ??!!! Do your self a favor, skip it.. seriously.","Technically I'am a Van Damme Fan, or I was. this movie is so wicked that I hated myself for lose those 90 moments. Do not gonna the name Isaac Florentine (Undisputed II) fool you, me had big desires for this one, depending on what I saw in (Undisputed II), man.. was I imperfect ??! all action fans didnt a big comeback for the classic action hero, but i guess we wont be able to see that soon, as our hero keep coming with those (going -to-a-border - far-away-town-and -kill -the-bad-guys- than-comeback- home) movies I mean for God's sake, we are in 2008, and they insist on doing those regretful movies on every class. Why ??!!! Do your self a prefers, leaps it.. seriously.",0.0002487301826477051,0.6784318685531616,0,1,0,446,"Successful"
"Honestly awful film, bad editing, awful lighting, dire dialog and scrappy screenplay.<br /><br />The lighting at is so bad there's moments you can't even see what's going on, I even tried to playing with the contrast and brightness so I could see something but that didn't help.<br /><br />They must have found the script in a bin, the character development is just as awful and while you hardly expect much from a Jean-Claude Van Damme film this one manages to hit an all time low. You can't even laugh at the cheesy'ness.<br /><br />The directing and editing are also terrible, the whole film follows an extremely tired routine and fails at every turn as it bumbles through the plot that is so weak it's just unreal.<br /><br />There's not a lot else to say other than it's really bad and nothing like Jean-Claude Van Damme's earlier work which you could enjoy.<br /><br />Avoid like the plaque, frankly words fail me in condemning this ""film"".","Honestly frightful film, filthy editor, nasty lighting, terrifying dialog and feisty script.<br /><br />The lighting at is also naughty there's minute you can't even listen what's going on, me even tried to playback with the reverse and light so I could peek something but that didn't supported.<br /><br />They must enjoys discovering the script in a bin, the kind elaborated is just as awful and while you hardly predicting severely from a Jean-Claude Vans Damme teatro this one handles to beating an all time low. You can't even laugh at the cheesy'ness.<br /><br />Both leadership and editors are also scary, the whole productions followed an remarkably weary frequent and fault at every inflection as it bumbles through the plots that is why weak it's just awesome.<br /><br />There's not a lots else to mention other than it's decidedly naughty and nothing like Jean-Claude Van Damme's anterior acted which you could likes.<br /><br />Shunned like the plaques, sincerely mots lack me in condemning this ""movie"".",0.0002028346061706543,0.7051620483398438,0,1,0,1724,"Successful"
"This flick is a waste of time.I expect from an action movie to have more than 2 explosions and some shooting.Van Damme's acting is awful. He never was much of an actor, but here it is worse.He was definitely better in his earlier movies. His screenplay part for the whole movie was probably not more than one page of stupid nonsense one liners.The whole dialog in the film is a disaster, same as the plot.The title ""The Shepherd"" makes no sense. Why didn't they just call it ""Border patrol""? The fighting scenes could have been better, but either they weren't able to afford it, or the fighting choreographer was suffering from lack of ideas.This is a cheap low type of action cinema.","This movie is a losing of deadlines.me expecting from an action picture to have more than 2 explosions and some shooting.Minivan Damme's behaving is awful. Her never was critically of an actors, but here it is greatest.It was definitely better in his yesteryear movies. His screenplay part for the whole movie was probably not more than one page of stupid foolish one liners.The whole dialog in the theaters is a calamity, same as the plot.The headlines ""The Berger"" makes no sense. Why didn't they just drew it ""Restrains patrol""? Both kampf scenes could have been brighter, but either they weren't able to afford it, or the fighting choreographer was sadness from lacked of view.That is a affordable low type of interventions cinema.",0.00016832351684570312,0.5747116804122925,0,1,0,712,"Successful"
