"original_text","perturbed_text","original_score","perturbed_score","original_output","perturbed_output","ground_truth_output","num_queries","result_type"
"Blind Date (Columbia Pictures, 1934), was a decent film, but I have a few issues with this film. First of all, I don't fault the actors in this film at all, but more or less, I have a problem with the script. Also, I understand that this film was made in the 1930's and people were looking to escape reality, but the script made Ann Sothern's character look weak. She kept going back and forth between suitors and I felt as though she should have stayed with Paul Kelly's character in the end. He truly did care about her and her family and would have done anything for her and he did by giving her up in the end to fickle Neil Hamilton who in my opinion was only out for a good time. Paul Kelly's character, although a workaholic was a man of integrity and truly loved Kitty (Ann Sothern) as opposed to Neil Hamilton, while he did like her a lot, I didn't see the depth of love that he had for her character. The production values were great, but the script could have used a little work.","Blind Date (Columbia Pictures, 1934), was a decent film, but I have a few issues with this film. First of all, I don't fault the actors in this film at all, but more or less, I get a challenging with the script. Also, I understand that this film was made in the 1930's and people were looking to escape reality, but the script made Ann Sothern's character look weak. She kept going back and forth between suitors and I felt as though she should have stayed with Paul Kelly's character in the end. He truly did care about her and her family and would have done anything for her and he did by giving her up in the end to fou Neil Hamilton who in my opinion was only out for a good time. Paul Kelly's character, although a workaholic was a man of integrity and truly loved Kitty (Ann Sothern) as opposed to Neil Hamilton, while he did like her a lot, I didn't see the depth of love that he had for her character. The production values were great, but the script could have used a little work.",0.008702993392944336,0.5075303316116333,0,1,0,190,"Successful"
"I first watched this movie back in the mid/late 80's, when I was a kid. We couldn't even get all the way through it. The dialog, the acting, everything about it was just beyond lame.<br /><br />Here are a few examples... imagine these spoken real dramatically, way over-acted: ""Oreegon? You're going to Oreegon? Why would anyone want to go to Oreegon?""<br /><br />""Survivalists? Nobody ever told us about any survivalists!""<br /><br />This movie was SO bad, my sister and I rented it again for her 16th birthday party, just so our friends could sit around and laugh at how awful it was. I don't think we were able to finish it then either!","I first watched this movie back in the averages/late 80's, when me was a kiddies. We couldn't even get all the lanes through it. The dialog, the behaved, everything about it was just beyond sad.<br /><br />Now are a rare instance... devine these talked true exceedingly, track over-acted: ""Oreegon? You're let to Oreegon? Why would anyone did to gonna to Oreegon?""<br /><br />""Survivalists? Nothing ever proclaims we about any survivalists!""<br /><br />This movie was SO poorly, my sister and me rent it again for her 16th birthday segment, just where our homeys could sessions around and giggles at how dire it was. I don't imagines we were unable to finished it then either!",0.000246584415435791,0.9581866264343262,0,1,0,829,"Successful"
"I saw the Mogul Video VHS of this. That's another one of those old 1980s distributors whose catalog I wish I had!<br /><br />This movie was pretty poor. Though retitled ""Don't Look in the Attic,"" the main admonition that is repeated in this is ""Don't go to the villa."" Just getting on the grounds of the villa is a bad idea. A character doesn't go into the attic until an hour into the movie, and actually should have done it earlier because of what is learned there.<br /><br />The movie starts in Turin, Italy in the 1950s. Two men are fighting, and a woman is telling them the villa is making them do it. One man kills the other, then regrets it, and the woman pulls out the knife and stabs him with it. She flees the villa, and after she's left a chair moves by itself (what's the point of that?), but when in the garden a hand comes up through the ground and drags he into the earth.<br /><br />From there, it's the present day, thirty years later. There's a séance that appears suddenly and doesn't appear to have anything to do with the movie. The children of the woman from the prologue are inheriting the house. The main daughter is played by the same actress who played her mother. At least one of the two men from the prologue seems to reoccur as another character too. She's haunted by some warnings not to go to the villa, but they all do, since if they do not use it, they forfeit it. People die. A lawyer who has won all his cases tries to investigate a little. The ending is pretty poor. Why was the family cursed? An unfortunately boring movie.<br /><br />There's an amusing small-print disclaimer on the back of the video box that reads ""The scenes depicted on this packaging may be an artist's impression and may not necessarily represent actual scenes from the film."" In this case, the cover of the box is an illustration that does more or less accurately depict the aforementioned woman dragged underground scene, although there are two hands, and the woman is different. It's true, sometimes the cover art has nothing to do with the movie. I also recall seeing a reviewer who had a bad movie predictor scale, in which movies with illustrations on the cover instead of photos got at least one point for that.","I saw the Mogul Video VHS of this. That's another one of those old 1980s distributors whose catalog I wish I had!<br /><br />This movie was lovely imperfect. Though retitled ""Don't Look in the Attic,"" the main admonition that is repeated in this is ""Don't go to the villa."" Just getting on the grounds of the villa is a counterproductive idea. A character doesn't go into the attic until an hour into the movie, and actually should have done it earlier because of what is learned there.<br /><br />The movie starts in Turin, Italy in the 1950s. Two men are fighting, and a woman is telling them the villa is making them do it. One man kills the other, then regrets it, and the woman pulls out the knife and stabs him with it. She flees the villa, and after she's left a chair moves by itself (what's the point of that?), but when in the garden a hand comes up through the ground and drags he into the earth.<br /><br />From there, it's the present day, thirty years later. There's a séance that appears suddenly and doesn't appear to have anything to do with the movie. The children of the woman from the prologue are inheriting the house. The main daughter is played by the same actress who played her mother. At least one of the two men from the prologue seems to reoccur as another character too. She's haunted by some warnings not to go to the villa, but they all do, since if they do not use it, they forfeit it. People die. A lawyer who has won all his cases tries to investigate a little. The ending is pretty poor. Why was the family cursed? An unfortunately boring movie.<br /><br />There's an amusing small-print disclaimer on the back of the video box that reads ""The scenes depicted on this packaging may be an artist's impression and may not necessarily represent actual scenes from the film."" In this case, the cover of the box is an illustration that does more or less accurately depict the aforementioned woman dragged underground scene, although there are two hands, and the woman is different. It's true, sometimes the cover art has nothing to do with the movie. I also recall seeing a reviewer who had a bad movie predictor scale, in which movies with illustrations on the cover instead of photos got at least one point for that.",0.0003884434700012207,0.6976093053817749,0,1,0,322,"Successful"
"A group of heirs to a mysterious old mansion find out that they have to live in it as part of a clause in the will or be disinherited, but they soon find out of its history of everybody whom had lived there before them having either died in weird accidents or having had killed each other.<br /><br />You've seen it all before, and this one is too low-budget and slow paced to be scary, and doesn't have any real surprises in the climax. No special effects or gore to speak of, in fact the only really amusing thing about the whole film is the quality of the English dubbing, which at times is as bad as a cheap martial arts movie.<br /><br />3 out of 10, pretty low in the pecking order of 80's haunted house movies.","A group of heirs to a mysterious old palais find out that they have to live in it as part of a clause in the will or be ostracized, but they soon pinpoint out of its history of everybody whom had lived there before them having either died in weird injures or having had killed each other.<br /><br />You've deemed it all before, and this one is too low-budget and lento paced to ai fear, and doesn't receive any exact surprises in the conclusion. No special effects or gore to speak of, in reality the only really lighthearted question about the whole film is the qualifications of the English copy, which at times is as bad as a cheap martial artists cinemas.<br /><br />3 out of 10, pretty low in the pecking order of 80's disturbed chambre movies.",0.00016736984252929688,0.5063709020614624,0,1,0,535,"Successful"
"Now, I LOVE Italian horror films. The cheesier they are, the better. However, this is not cheesy Italian. This is week-old spaghetti sauce with rotting meatballs. It is amateur hour on every level. There is no suspense, no horror, with just a few drops of blood scattered around to remind you that you are in fact watching a horror film. The ""special effects"" consist of the lights changing to red whenever the ghost (or whatever it was supposed to be) is around, and a string pulling bed sheets up and down. Oooh, can you feel the chills? The DVD quality is that of a VHS transfer (which actually helps the film more than hurts it). The dubbing is below even the lowest ""bad Italian movie"" standards and I gave it one star just because the dialogue is so hilarious! And what do we discover when she finally DOES look in the attic (in a scene that is daytime one minute and night the next)...well, I won't spoil it for anyone who really wants to see, but let's just say that it isn't very ""novel""!","Now, I LOVE Italian horror films. The cheesier they are, the exemplary. Even, this is not cheesy Italian. This is week-old spaghetti sauce with rotting meatballs. It is fond hour on every layers. There is no awaits, no horror, with just a few drops of blood scattered around to remind you that you are in fact watching a horror film. The ""special effects"" consist of the lights changing to red whenever the ghost (or whatever it was supposed to be) is around, and a string pulling bed sheets up and down. Oooh, can you feel the chills? The DVD quality is that of a VHS transfer (which actually helps the film more than hurts it). The dubbing is below even the lowest ""bad Italian movie"" standards and I gave it one star just as the dialogue is so hilarious! And what do we discover when she finally DOES look in the attic (in a scene that is daytime one minute and night the next)...well, I won't spoil it for anyone who really wants to see, but let's just say that it isn't very ""novel""!",0.0003083944320678711,0.6201891303062439,0,1,0,191,"Successful"
"This cheap, grainy-filmed Italian flick is about a couple of inheritors of a manor in the Italian countryside who head up to the house to stay, and then find themselves getting killed off by ghosts of people killed in that house.<br /><br />I wasn't impressed by this. It wasn't really that scary, mostly just the way a cheap Italian film should be. A girl, her two cousins, and one cousin's girlfriend, head to this huge house for some reason (I couldn't figure out why) and are staying there, cleaning up and checking out the place. Characters come in and out of the film, and it's quite boring at points, and the majority of deaths are quite rushed. The girlfriend is hit by a car when fleeing the house after having a dream of her death, and the scene is quite good, but then things get slow again, until a confusing end, when the male cousins are killed together in some weird way, and this weirdo guy (I couldn't figure out who he was during the movie, or maybe I just don't remember) goes after this one girl, attacking her, until finally this other girl kills him off. Hate to give away the ending, but oh well. The female cousin decides to stay at the house and watch over it, and they show scenes of her living there years later. The end. You really aren't missing anything, and anyway, you probably won't find this anywhere, so lucky you.","That affordable, grainy-filmed Italian teatro is about a couple of inheritors of a manor in the Italian countryside who head up to the house to stay, and then find themselves getting killed off by ghosts of people killed in that house.<br /><br />I wasn't impressed by this. It wasn't really that scary, mostly just the way a cheep Sicilian cinematography should be. A girl, her two cousins, and one cousin's girlfriend, head to this huge house for some reason (I couldn't figure out why) and are staying there, cleaning up and checking out the place. Peculiarity come in and out of the film, and it's quite drudgery at points, and the gros of deaths are quite rushed. The girlfriend is hit by a car when fleeing the house after having a dream of her death, and the scene is quite good, but then matters get slow again, until a confusing end, when the male cousins are killed together in some weird way, and this weirdo guy (I couldn't figure out who he was during the movie, or maybe I just don't remember) goes after this one girl, attacking her, until finally this other girl kills him off. Hate to give away the ending, but oh well. The female cousin decides to stay at the house and watch over it, and they show scenes of her living there years later. The end. You really aren't missing anything, and anyway, you probably won't find this anywhere, so lucky you.",0.00023001432418823242,0.5682719349861145,0,1,0,264,"Successful"
"I just finished watching this movie and am disappointed to say that I didn't enjoy it a bit. It is so slow Slow and uninteresting. This kid from Harry Potter plays a shy teenager with an rude mother, and then one day the rude mother tells the kid to find a job so that they could accommodate an old guy apparently having no place to live has started to live with his family and therefore the kid goes to work for a old lady. And this old lady who is living all alone teaches him about girls, driving car and life! I couldn't get how an 18 year old guy enjoy spending time with an awful lady in her 80s. Sorry if my comments on this movie has bothered people who might have enjoyed it, I could be wrong as I am not British and may not understand the social and their family structure and way of life. Mostly the movie is made for the British audience.","I just finished watching this movie and am disappointed to say that I didn't enjoy it a bit. It is so lento Slow and humdrum. This kid from Harry Potter dessert a shy teenager with an rude mother, and then one day the rude mother tells the kid to find a job so that they could accommodate an old guy apparently having no place to live has started to live with his family and therefore the kid goes to work for a old lady. And this old lady who is living all alone teaches him about girls, driving car and life! I couldn't get how an 18 year old guy enjoy spending time with an egregious lady in her 80s. Sorry if my comments on this movie has bothered people who might have enjoyed it, I could be wrong as I am not British and may not understand the social and their family structure and way of life. Mostly the movie is made for the British listeners.",0.0002129673957824707,0.5694385766983032,0,1,0,230,"Successful"
"Ben, (Rupert Grint), is a deeply unhappy adolescent, the son of his unhappily married parents. His father, (Nicholas Farrell), is a vicar and his mother, (Laura Linney), is ... well, let's just say she's a somewhat hypocritical soldier in Jesus' army. It's only when he takes a summer job as an assistant to a foul-mouthed, eccentric, once-famous and now-forgotten actress Evie Walton, (Julie Walters), that he finally finds himself in true 'Harold and Maude' fashion. Of course, Evie is deeply unhappy herself and it's only when these two sad sacks find each other that they can put their mutual misery aside and hit the road to happiness.<br /><br />Of course it's corny and sentimental and very predictable but it has a hard side to it, too and Walters, who could sleep-walk her way through this sort of thing if she wanted, is excellent. It's when she puts the craziness to one side and finds the pathos in the character, (like hitting the bottle and throwing up in the sink), that she's at her best. The problem is she's the only interesting character in the film (and it's not because of the script which doesn't do anybody any favours). Grint, on the other hand, isn't just unhappy; he's a bit of a bore as well while Linney's starched bitch is completely one-dimensional. (Still, she's got the English accent off pat). The best that can be said for it is that it's mildly enjoyable - with the emphasis on the mildly.","Ben, (Rupert Grint), is a deeply unhappy adolescent, the son of his unhappily married parents. His father, (Nicholas Farrell), is a vicar and his mother, (Laura Linney), is ... well, let's just say she's a somewhat hypocritical soldier in Jesus' army. It's only when he takes a summer job as an assistant to a foul-mouthed, eccentric, once-famous and now-forgotten actress Evie Walton, (Julie Walters), that he finally finds himself in true 'Harold and Maude' fashion. Of course, Evie is deeply unhappy herself and it's only when these two sad sacks find each other that they can put their mutual misery aside and hit the road to happiness.<br /><br />Of course it's corny and sentimental and very predictable but it has a hard side to it, too and Walters, who could sleep-walk her way through this sort of thing if she wanted, is excellent. It's when she puts the craziness to one side and finds the pathos in the character, (like hitting the bottle and throwing up in the sink), that she's at her best. The problem is she's the only interesting character in the film (and it's not because of the script which doesn't do anybody any favours). Grint, on the other hand, isn't just unhappy; he's a bit of a bore as well while Linney's starched bitch is completely one-dimensional. (Still, she's got the English accent off pat). The best that can be said for it is that it's mildly enjoyable - with the emphasis on the mildly.",0.9995967149734497,0.9995967149734497,1,1,0,1,"Skipped"
"Every movie I have PPV'd because Leonard Maltin praised it to the skies has blown chunks! Every single one! When will I ever learn?<br /><br />Evie is a raving Old Bag who thinks nothing of saying she's dying of breast cancer to get her way! Laura is an insufferable Medusa filled with The Holy Spirit (and her hubby's protégé)! Caught between these harpies is Medusa's dumb-as-a-rock boy who has been pressed into weed-pulling servitude by The Old Bag!<br /><br />As I said, when will I ever learn?<br /><br />I was temporarily lifted out of my malaise when The Old Bag stuck her head in a sink, but, unfortunately, she did not die. I was temporarily lifted out of my malaise again when Medusa got mowed down, but, unfortunately, she did not die. It should be a capital offense to torture audiences like this!<br /><br />Without Harry Potter to kick him around, Rupert Grint is just a pair of big blue eyes that practically bulge out of its sockets. Julie Walters's scenery-chewing (especially the scene when she ""plays"" God) is even more shameless than her character.<br /><br />At least this Harold bangs some bimbo instead of Maude. For that, I am truly grateful. And if you're reading this Mr. Maltin, you owe me $3.99!","Every movie I have PPV'd for Schoen Maltin praised it to the skies has blown chunks! Every single one! When will I ever learn?<br /><br />Evie is a bonkers Old Bag who thinks nothing of saying she's dying of breast tumors to get her way! Laura is an insufferable Medusa filled with The Holy Spirit (and her hubby's protégé)! Trapped between these fiends is Medusa's dumb-as-a-rock boy who has been pressed into weed-pulling serf by The Old Bag!<br /><br />As I said, when will I ever learn?<br /><br />I was temporarily lifted out of my malaise when The Old Bag stuck her head in a sink, but, unfortunately, she did not lives. I was temporarily lifted out of my malaise again when Medusa got lawns down, but, unfortunately, she did not mort. It should be a capital offense to torture audiences like this!<br /><br />Without Harry Potter to kick him around, Rupert Grint is just a pair of big blue eyes that practically bulge out of its sockets. Julie Walters's scenery-chewing (widely the cinemas when she ""games"" Seigneur) is even more crass than her idiosyncrasies.<br /><br />By least this Harold bangs some bitchy instead of Dorothy. For that, I am truly grateful. And if you're reading this Yannick. Maltin, you owe me $3.99!",0.0005027055740356445,0.5144312381744385,0,1,0,649,"Successful"
"Low budget horror movie. If you don't raise your expectations too high, you'll probably enjoy this little flick. Beginning and end are pretty good, middle drags at times and seems to go nowhere for long periods as we watch the goings on of the insane that add atmosphere but do not advance the plot. Quite a bit of gore. I enjoyed Bill McGhee's performance which he made quite believable for such a low budget picture, he managed to carry the movie at times when nothing much seemed to be happening. Nurse Charlotte Beale, played by Jesse Lee, played her character well so be prepared to want to slap her toward the end! She makes some really stupid mistakes but then, that's what makes these low budget movies so good! I would have been out of that place and five states away long before she even considered that it might be a good idea to leave! If you enjoy this movie, try Committed from 1988 which is basically a rip off of this movie.","Low budget horror movie. If you don't raise your expectations too high, you'll probably enjoy this little flick. Beginning and end are pretty good, middle drags at times and seems to go nowhere for long periods as we watch the goings on of the insane that add atmosphere but do not advance the plot. Quite a bit of gore. I enjoyed Bill McGhee's performance which he made quite believable for such a low budget picture, he managed to carry the movie at times when nothing much seemed to be happening. Nurse Charlotte Beale, played by Jesse Lee, played her character well so be prepared to want to slap her toward the end! She makes some really stupid mistakes but then, that's what makes these low budget movies so good! I would have been out of that place and five states away long before she even considered that it might be a good idea to leave! If you enjoy this movie, try Committed from 1988 which is basically a rip off of this movie.",0.9981396794319153,0.9981396794319153,1,1,0,1,"Skipped"
